<!DOCTYPE flight_plan SYSTEM "../flight_plan.dtd">
<flight_plan alt="38" ground_alt="0" lat0="52.1681551" lon0="4.4126468" max_dist_from_home="1070" name="Bebop EHVB Guided" security_height="2">
  <header>
    #include "modules/datalink/datalink.h"
    #include "modules/energy/electrical.h"
    #include "modules/radio_control/radio_control.h"
    #include "modules/ahrs/ahrs.h"
    #include "autopilot.h"
    inline void setNav(void){
      autopilot_mode_auto2 = AP_MODE_NAV;
      autopilot_static_set_mode(AP_MODE_NAV);
    }
    inline void setGuided(void){
      autopilot_mode_auto2 = AP_MODE_GUIDED;
      autopilot_static_set_mode(AP_MODE_GUIDED);
    }
  </header>
  
  <waypoints>
    <waypoint name="HOME" x="0" y="0"/>
    <waypoint name="CLIMB" x="10" y="10"/>
    <waypoint name="STDBY" x="66" y="-89"/>
    <waypoint name="TD" x="0" y="0"/>
    <waypoint name="p1" x="100" y="50"/>
    <waypoint name="p2" x="250" y="75"/>
    <waypoint name="p3" x="275" y="-75"/>
    <waypoint name="p4" x="140" y="-120"/>

    <waypoint lat="52.1692076" lon="4.4109107" name="C1"/>
    <waypoint lat="52.1679041" lon="4.4115361" name="C2"/>
    <waypoint lat="52.1667648" lon="4.4121616" name="C3"/>
    <waypoint lat="52.1658477" lon="4.4128391" name="C4"/>
    <waypoint lat="52.1653038" lon="4.4140299" name="C5"/>
    <waypoint lat="52.1649048" lon="4.4164123" name="C6"/>
    <waypoint lat="52.1677828" lon="4.4218386" name="C7"/>
    <waypoint lat="52.1691056" lon="4.4209875" name="C8"/>
    <waypoint lat="52.1709731" lon="4.4187533" name="C9"/>

    <waypoint lat="52.1689778" lon="4.4120424" name="S1"/>
    <waypoint lat="52.1676834" lon="4.4128426" name="S2"/>
    <waypoint lat="52.1670734" lon="4.4131911" name="S3"/>
    <waypoint lat="52.1661943" lon="4.4137259" name="S4"/>
    <waypoint lat="52.1658967" lon="4.4147855" name="S5"/>
    <waypoint lat="52.1655207" lon="4.4159736" name="S6"/>
    <waypoint lat="52.1678818" lon="4.4205845" name="S7"/>
    <waypoint lat="52.1686448" lon="4.4200855" name="S8"/>
    <waypoint lat="52.1703410" lon="4.4180236" name="S9"/>
  </waypoints>

  <sectors>
    <sector color="red" name="Flyzone">
      <corner name="C1"/>
      <corner name="C2"/>
      <corner name="C3"/>
      <corner name="C4"/>
      <corner name="C5"/>
      <corner name="C6"/>
      <corner name="C7"/>
      <corner name="C8"/>
      <corner name="C9"/>
    </sector>
    <sector color="orange" name="SoftGeofence">
      <corner name="S1"/>
      <corner name="S2"/>
      <corner name="S3"/>
      <corner name="S4"/>
      <corner name="S5"/>
      <corner name="S6"/>
      <corner name="S7"/>
      <corner name="S8"/>
      <corner name="S9"/>
    </sector>
  </sectors>
<!-- 
  <exceptions>
    <exception cond="((datalink_time @GT 5) @AND
      !(IndexOfBlock('Holding point') @GT nav_block) @AND
      !(nav_block >= IndexOfBlock('land here')) @AND
      (autopilot_in_flight() == true) )" deroute="land here"/>
    
    <exception cond="(!InsideFlyzone(GetPosX(), GetPosY()) @AND
      !(IndexOfBlock('Holding point') @GT nav_block) @AND
      !(nav_block >= IndexOfBlock('land here')) @AND
      (autopilot_in_flight() == true) )" deroute="land here"/>

    <exception cond="((GetPosAlt() @GT 100.0) @AND
      !(IndexOfBlock('Holding point') @GT nav_block) @AND
      !(nav_block >= IndexOfBlock('land here')) @AND
      (autopilot_in_flight() == true) )" deroute="land here"/>

    <exception cond="(electrical.bat_low @AND
      !(IndexOfBlock('Holding point') @GT nav_block) @AND
      !(nav_block >= IndexOfBlock('land here')) @AND
      (autopilot_in_flight() == true) )" deroute="land here"/>
      
    <exception cond="(electrical.bat_critical @AND
      !(IndexOfBlock('Holding point') @GT nav_block) @AND
      !(nav_block >= IndexOfBlock('land here')) @AND
      (autopilot_in_flight() == true) )" deroute="land here"/>
  </exceptions> -->

  <exceptions>
    <exception cond="(!InsideFlyzone(GetPosX(), GetPosY()) @AND
      !(IndexOfBlock('Holding point') @GT nav_block) @AND
      !(nav_block >= IndexOfBlock('land here')) @AND
      (autopilot_in_flight() == true) )" deroute="land here"/>

    <exception cond="(!InsideSoftGeofence(GetPosX(), GetPosY()) @AND
      !(IndexOfBlock('Holding point') @GT nav_block) @AND
      !(nav_block >= IndexOfBlock('land here')) @AND
      (autopilot_in_flight() == true) )" deroute="Return Safe"/>

    <exception cond="((datalink_time @GT 5) @AND
      !(IndexOfBlock('Holding point') @GT nav_block) @AND
      !(nav_block >= IndexOfBlock('land here')) @AND
      (autopilot_in_flight() == true) )" deroute="land here"/>

    <exception cond="((GetPosAlt() @GT 150.0) @AND
      !(IndexOfBlock('Holding point') @GT nav_block) @AND
      !(nav_block >= IndexOfBlock('land here')) @AND
      (autopilot_in_flight() == true) )" deroute="land here"/>

    <exception cond="(electrical.bat_low @AND
      !(IndexOfBlock('Holding point') @GT nav_block) @AND
      !(nav_block >= IndexOfBlock('land here')) @AND
      (autopilot_in_flight() == true) )" deroute="land here"/>
      
    <exception cond="(electrical.bat_critical @AND
      !(IndexOfBlock('Holding point') @GT nav_block) @AND
      !(nav_block >= IndexOfBlock('land here')) @AND
      (autopilot_in_flight() == true) )" deroute="land here"/>
  </exceptions>

  <blocks>
    <block name="Wait GPS">
      <call_once fun="NavKillThrottle()"/>
      <while cond="!GpsFixValid()"/>
    </block>
    
    <block name="Geo init">
      <while cond="LessThan(NavBlockTime(), 10)"/>
      <call_once fun="NavSetAltitudeReferenceHere()"/>
    </block>
    
    <block name="Holding point">
      <call_once fun="NavKillThrottle()"/>
      <attitude pitch="0" roll="0" throttle="0" until="FALSE" vmode="throttle"/>
    </block>
    
    <block key="r" name="Start Engine">
      <call_once fun="NavResurrect()"/>
      <attitude pitch="0" roll="0" throttle="0" until="FALSE" vmode="throttle"/>
    </block>
    
    <block key="t" name="Takeoff" strip_button="Takeoff" strip_icon="takeoff.png">
      <exception cond="GetPosAlt() @GT 2.0" deroute="Standby"/>
      <call_once fun="NavSetWaypointHere(WP_CLIMB)"/>
      <call_once fun="autopilot_set_in_flight(true)"/>
      <stay climb="nav.climb_vspeed" vmode="climb" wp="CLIMB"/>
    </block>
    
    <block key="s" name="Standby" strip_button="Standby" strip_icon="home.png">
      <call_once fun="NavSetWaypointHere(WP_STDBY)"/>
      <stay wp="STDBY"/>
    </block>

    <block key="g" name="START" strip_button="Go Guided" strip_icon="lookfore.png">
      <call_once fun="setGuided()"/>
      <stay wp="STDBY"/>
    </block>
    
    <block name="STOP">
      <call_once fun="NavSetWaypointHere(WP_STDBY)"/>
      <call_once fun="setNav()"/>
      <stay wp="STDBY"/>
    </block>

    <block name="Route Path" strip_button="Route Path" strip_icon="path.png">
      <call_once fun="setNav()"/>
      <go wp="p1"/>
      
      <go from="p1" hmode="route" wp="p2"/>
      <go from="p2" hmode="route" wp="p3"/>
      <go from="p3" hmode="route" wp="p4"/>
      <go from="p4" hmode="route" wp="p1"/>
      
      <deroute block="Route Path"/>
    </block>

    <block name="Return Safe" strip_button="Return Safe" strip_icon="home.png">
      <call_once fun="setNav()"/>
      <stay wp="HOME"/>
    </block>
    
    <block key="l" name="land here" strip_button="Land Here" strip_icon="land-right.png">
      <call_once fun="setNav()"/>
      <call_once fun="NavSetWaypointHere(WP_TD)"/>
      <deroute block="Flare"/>
    </block>
    
    <block name="Land">
      <call_once fun="setNav()"/>
      <deroute block="Flare"/>
    </block>
    
    <block name="Flare">
      <!-- <exception cond="NavDetectGround()" deroute="Holding point"/> -->
      <exception cond="!nav_is_in_flight()" deroute="Landed"/>
      <exception cond="0.10 @GT GetPosAlt()" deroute="Landed"/>
      <!-- <call_once fun="NavStartDetectGround()"/> -->
      <stay climb="-0.8" vmode="climb" wp="TD"/>
    </block>
    
    <block name="Landed">
      <call_once fun="NavKillThrottle()"/>
      <attitude pitch="0" roll="0" throttle="0" until="FALSE" vmode="throttle"/>
    </block>
  </blocks>
</flight_plan>