<!DOCTYPE flight_plan SYSTEM "../flight_plan.dtd">

<flight_plan alt="55" ground_alt="0" lat0="52.168595" lon0="4.412444" max_dist_from_home="700" name="Overactuated vehicle Valkenburg" security_height="20">
  <header>
    #include "autopilot.h"
    #include "modules/datalink/datalink.h"
    #include "modules/Overactuated_vehicle/Overactuated_mixing.h"
    static inline bool delay_test_rc(bool test, int delay) {
      static int nb = 0;
        if (test) {
        nb++;
        if (nb == delay) {
          nb = 0;
          return true;
        }
        return false;
      } else {
        nb = 0;
        return false;
      }
    }
</header>
  <waypoints>
    <waypoint name="HOME" x="12.6" y="-48.7"/>
    <waypoint name="CLIMB" x="62.6" y="-80.4"/>
    <waypoint lat="52.1682794" lon="4.4139911" name="STDBY"/>
    <waypoint lat="52.1694940" lon="4.4155585" name="p1"/>
    <waypoint lat="52.167791" lon="4.416685" name="p2"/>
    <waypoint lat="52.1671481" lon="4.4141374" name="p3"/>
    <waypoint lat="52.1689418" lon="4.4132070" name="p4"/>
    <waypoint lat="52.1681602" lon="4.4127708" name="TD"/>
    <waypoint lat="52.1680902" lon="4.4148029" name="APP"/>
    <waypoint lat="52.1686922" lon="4.4149181" name="FOLLOW"/>
    <waypoint lat="52.169599" lon="4.417198" name="FOLLOW_ARUCO"/>
    <waypoint lat="52.169742" lon="4.411045" name="C1"/>
    <waypoint lat="52.168740" lon="4.407411" name="C2"/>
    <waypoint lat="52.166515" lon="4.408235" name="C3"/>
    <waypoint lat="52.164107" lon="4.410072" name="C4"/>
    <waypoint lat="52.162922" lon="4.412524" name="C5"/>
    <waypoint lat="52.163563" lon="4.417368" name="C6"/>
    <waypoint lat="52.166336" lon="4.424451" name="C7"/>
    <waypoint lat="52.169063" lon="4.423567" name="C8"/>
    <waypoint lat="52.172299" lon="4.421081" name="C9"/>
    <waypoint lat="52.170384" lon="4.416553" name="FLY1"/>
    <waypoint lat="52.169892" lon="4.414011" name="FLY2"/>
    <waypoint lat="52.169201" lon="4.411394" name="FLY3"/>
    <waypoint lat="52.166201" lon="4.413254" name="FLY4"/>
    <waypoint lat="52.165909" lon="4.415910" name="FLY5"/>
    <waypoint lat="52.166849" lon="4.419219" name="FLY6"/>
    <waypoint lat="52.167911" lon="4.418455" name="FLY7"/>
    <waypoint lat="52.168774" lon="4.417835" name="FLY8"/>
    <waypoint lat="52.169599" lon="4.417198" name="FLY9"/>
  </waypoints>
  <sectors>
    <sector color="orange" name="Safe_area">
      <corner name="FLY1"/>
      <corner name="FLY2"/>
      <corner name="FLY3"/>
      <corner name="FLY4"/>
      <corner name="FLY5"/>
      <corner name="FLY6"/>
      <corner name="FLY7"/>
      <corner name="FLY8"/>
      <corner name="FLY9"/>
    </sector>
    <sector color="red" name="Flight_area">
      <corner name="C1"/>
      <corner name="C2"/>
      <corner name="C3"/>
      <corner name="C4"/>
      <corner name="C5"/>
      <corner name="C6"/>
      <corner name="C7"/>
      <corner name="C8"/>
      <corner name="C9"/>
    </sector>
  </sectors>
  <exceptions>

  </exceptions>
  <blocks>
    <block name="Enter_AP_MODE_RC_DIRECT">
      <set value="AP_MODE_RC_DIRECT" var="autopilot.mode"/>
    </block>
    <block name="Wait GPS">
      <call_once fun="NavKillThrottle()"/>
      <while cond="!GpsFixValid() || !state.ned_initialized_i"/>
    </block>
    <block name="Geo init">
      <while cond="LessThan(NavBlockTime(), 10)"/>
      <call_once fun="NavSetAltitudeReferenceHere()"/>
    </block>
    <block name="Holding point">
      <call_once fun="NavKillThrottle()"/>
      <attitude pitch="0" roll="0" throttle="0" until="FALSE" pre_call="NavKillThrottle()" vmode="throttle"/>
    </block>
  </blocks>
</flight_plan>
