<?xml version="1.0"?>
<!DOCTYPE flight_plan SYSTEM "../flight_plan.dtd">
<flight_plan alt="60" ground_alt="0" lat0="52.168595" lon0="4.412444" max_dist_from_home="5000" name="Nederdrone Valkenburg" security_height="2">
  <header>
    #include "autopilot.h"
    #include "modules/datalink/datalink.h"
</header>
  <waypoints>
    <waypoint name="HOME" x="12.6" y="-48.7"/>
    <waypoint name="CLIMB" x="62.6" y="-80.4"/>
    <waypoint name="STDBY" x="106.0" y="-55.1"/>
    <waypoint name="p1" x="298.634" y="-260.614"/>
    <waypoint name="p2" x="696.0" y="-148.1"/>
    <waypoint name="p3" x="600.4" y="73.4"/>
    <waypoint name="p4" x="238.6" y="-48.5"/>
    <waypoint name="TD" x="-4.1" y="-23.7"/>
    <!-- <waypoint name="FOLLOW" x="123.2" y="-87.8"/> -->
    <waypoint name="l1" lat="52.1685507" lon="4.4123303" alt="20"/>
    <waypoint name="l2" lat="52.1662956" lon="4.4135311" alt="0"/>
    <waypoint lat="52.169189" lon="4.410820" name="C1"/>
    <waypoint lat="52.168049" lon="4.406923" name="C2"/>
    <waypoint lat="52.166515" lon="4.408235" name="C3"/>
    <waypoint lat="52.163255" lon="4.407668" name="C4"/>
    <waypoint lat="52.161908" lon="4.410082" name="C5"/>
    <waypoint lat="52.162641" lon="4.416992" name="C6"/>
    <waypoint lat="52.164861" lon="4.427268" name="C7"/>
    <waypoint lat="52.170422" lon="4.427511" name="C8"/>
    <waypoint lat="52.172276" lon="4.424011" name="C9"/>
  </waypoints>
  <sectors>
    <sector color="red" name="Flyzone">
      <corner name="C1"/>
      <corner name="C2"/>
      <corner name="C3"/>
      <corner name="C4"/>
      <corner name="C5"/>
      <corner name="C6"/>
      <corner name="C7"/>
      <corner name="C8"/>
      <corner name="C9"/>
    </sector>
  </sectors>
  <variables>
    <variable var="gear_pitch" init="-50" type="float" min="-90.0" max="0." step="1.0"/>
    <variable var="takeoff_thrust" init="0.85" type="float" min="0." max="1.0" step="0.01"/>
  </variables>
  <modules>
    <!--module name="follow_me"/-->
    <module name="nav" type="survey_rectangle_rotorcraft">
      <define name="RECTANGLE_SURVEY_DEFAULT_SWEEP" value="100"/>
    </module>
  </modules>
  <exceptions>
    <exception cond="Or(!InsideFlyzone(GetPosX(), GetPosY()), GetPosAlt() @GT GetAltRef() + 1500) @AND !(nav_block == IndexOfBlock('Wait GPS')) @AND !(nav_block == IndexOfBlock('Geo init')) @AND !(nav_block == IndexOfBlock('Holding point'))" deroute="Holding point"/>
    <exception cond="datalink_time @GT 25 @AND !(nav_block == IndexOfBlock('Wait GPS')) @AND !(nav_block == IndexOfBlock('Geo init')) @AND !(nav_block == IndexOfBlock('Holding point')) @AND !(nav_block == IndexOfBlock('Standby'))" deroute="Standby"/>
  </exceptions>
  <blocks>
    <block name="Wait GPS">
      <call_once fun="NavKillThrottle()"/>
      <while cond="!GpsFixValid() || !state.ned_initialized_i"/>
    </block>
    <block name="Geo init">
      <while cond="LessThan(NavBlockTime(), 10)"/>
      <call_once fun="NavSetAltitudeReferenceHere()"/>
    </block>
    <block name="Holding point">
      <call_once fun="NavKillThrottle()"/>
      <attitude pitch="0" roll="0" throttle="0" until="FALSE" vmode="throttle"/>
    </block>
    <block name="Start Engine" strip_button="Takeoff" strip_icon="takeoff.png">
      <set value="FALSE" var="agl_inflight"/>
      <set value="FALSE" var="force_forward"/>
      <set value="DegOfRad(stateGetNedToBodyEulers_f()->theta)" var="gear_pitch"/>
      <call_once fun="waypoint_set_xy_i(WP_CLIMB,POS_BFP_OF_REAL(GetPosX()+100.0*sinf(stateGetNedToBodyEulers_f()->psi)),POS_BFP_OF_REAL(GetPosY()+100.0*cosf(stateGetNedToBodyEulers_f()->psi)))"/>
      <call_once fun="NavResurrect()"/>
      <call_once fun="nav_set_heading_current()"/>
      <attitude pitch="gear_pitch" roll="0" throttle="0.0" until="stage_time @GT 1" vmode="throttle"/>
    </block>
    <block name="Rolling Phase">
      <exception cond="GetPosHeight() @GT 5.0" deroute="Climb"/>
      <call_once fun="nav_set_heading_current()"/>
      <attitude pitch="gear_pitch" roll="0" throttle="takeoff_thrust" vmode="throttle"/>
    </block>
    <block name="Climb">
      <exception cond="GetPosHeight() @GT 30.0" deroute="Oval"/>
      <call_once fun="nav_set_heading_current()"/>
      <go climb="nav.climb_vspeed" vmode="climb" wp="CLIMB"/>
      <deroute block="Oval"/>
    </block>
    <block name="Standby" strip_button="Standby" strip_icon="home.png">
      <set value="FALSE" var="force_forward"/>
      <stay wp="STDBY"/>
    </block>
    <block name="stay_p1">
      <set value="FALSE" var="force_forward"/>
      <stay wp="p1"/>
    </block>
    <block name="go_p2">
      <set value="TRUE" var="force_forward"/>
      <go wp="p2"/>
      <deroute block="stay_p1"/>
    </block>
    <block name="line_p1_p2">
      <set value="TRUE" var="force_forward"/>
      <go from="p1" hmode="route" wp="p2"/>
      <stay until="stage_time @GT 10" wp="p2"/>
      <go from="p2" hmode="route" wp="p1"/>
      <deroute block="line_p1_p2"/>
    </block>
    <block name="route">
      <set value="TRUE" var="force_forward"/>
      <go from="p1" hmode="route" wp="p2"/>
      <go from="p2" hmode="route" wp="p3"/>
      <go from="p3" hmode="route" wp="p4"/>
      <go from="p4" hmode="route" wp="p1"/>
      <deroute block="route"/>
    </block>
    <block name="Oval">
      <set value="TRUE" var="force_forward"/>
      <oval p1="p1" p2="p2" radius="nav.radius"/>
    </block>
    <block name="landing line l1 l2">
      <set value="TRUE" var="force_forward"/>
      <go wp="l1"/>
      <go from="l1" hmode="route" wp="l2" vmode="climb" climb="nav.descend_vspeed"/>
      <stay wp="l2"/>
    </block>
    <block name="land here" strip_button="Land Here" strip_icon="land-right.png">
      <set value="FALSE" var="force_forward"/>
      <call_once fun="NavSetWaypointHere(WP_TD)"/>
    </block>
    <block name="land">
      <set value="FALSE" var="force_forward"/>
      <go wp="TD"/>
    </block>
    <block name="descend">
      <set value="FALSE" var="force_forward"/>
      <exception cond="LessThan(GetPosHeight(), 15.0)" deroute="flare"/>
      <stay climb="nav.descend_vspeed" vmode="climb" wp="TD"/>
    </block>
    <block name="flare">
      <set value="FALSE" var="force_forward"/>
      <stay climb="-0.5" vmode="climb" wp="TD"/>
    </block>
    <block name="landed">
      <set value="FALSE" var="force_forward"/>
      <attitude pitch="0" roll="0" throttle="0" until="FALSE" vmode="throttle"/>
    </block>
  </blocks>
</flight_plan>
