<!DOCTYPE flight_plan SYSTEM "../flight_plan.dtd">

<flight_plan alt="8" ground_alt="0" lat0="51 59 27.6" lon0="4 22 42.0" max_dist_from_home="1000" name="Delft Basic" security_height="5">
  <header>
    #include "autopilot.h"
    #include "subsystems/datalink/datalink.h"
    #include "subsystems/radio_control.h"
</header>
  <waypoints>
    <waypoint name="HOME" x="0.0" y="0.0"/>
    <waypoint name="CLIMB" x="0.0" y="5.0"/>
    <waypoint name="STDBY" x="-2.0" y="-5.0"/>
    <waypoint name="p1" x="-11.7" y="1.6"/>
    <waypoint name="p2" x="6.2" y="9.2"/>
    <waypoint name="p3" x="20.0" y="-16.3"/>
    <waypoint name="p4" x="-0.8" y="-25.1"/>
    <waypoint name="TD" x="5.6" y="-10.9"/>
    <waypoint name="HGF1" x="-92.6" y="60.7"/>
    <waypoint name="HGF2" x="-20.1" y="-96.0"/>
    <waypoint name="HGF3" x="114.9" y="-33.3"/>
    <waypoint name="HGF4" x="21.3" y="103.7"/>
    <waypoint name="SGF1" x="-48.4" y="34.3"/>
    <waypoint name="SGF2" x="-5.7" y="-52.6"/>
    <waypoint name="SGF3" x="46.5" y="-35.7"/>
    <waypoint name="SGF4" x="3.4" y="52.7"/>
  </waypoints>
  <sectors>
    <sector color="red" name="HardGeofence">
      <corner name="HGF1"/>
      <corner name="HGF2"/>
      <corner name="HGF3"/>
      <corner name="HGF4"/>
    </sector>
    <sector color="yellow" name="SoftGeofence">
      <corner name="SGF1"/>
      <corner name="SGF2"/>
      <corner name="SGF3"/>
      <corner name="SGF4"/>
    </sector>
  </sectors>
  <exceptions>
    <exception cond="Or(!InsideHardGeofence(GetPosX(), GetPosY()), GetPosAlt() > GetAltRef() + 100) && !(nav_block == IndexOfBlock('Wait GPS')) && !(nav_block == IndexOfBlock('Geo init')) && !(nav_block == IndexOfBlock('Holding point'))" deroute="Holding point"/>
    <exception cond="Or(!InsideSoftGeofence(GetPosX(), GetPosY()), GetPosAlt() > GetAltRef() + 100) && !(nav_block == IndexOfBlock('Wait GPS')) && !(nav_block == IndexOfBlock('Geo init')) && !(nav_block == IndexOfBlock('Holding point'))" deroute="Standby"/>
    <exception cond="And(radio_control.status == RC_REALLY_LOST, datalink_time > 25) && !(nav_block == IndexOfBlock('Wait GPS')) && !(nav_block == IndexOfBlock('Geo init')) && !(nav_block == IndexOfBlock('Holding point'))" deroute="land"/>
    <exception cond="datalink_time > 20 && !(nav_block == IndexOfBlock('Wait GPS')) && !(nav_block == IndexOfBlock('Geo init')) && !(nav_block == IndexOfBlock('Holding point')) && !(nav_block == IndexOfBlock('Standby'))" deroute="Standby"/>
  </exceptions>
  <blocks>
    <block name="Wait GPS">
      <call_once fun="NavKillThrottle()"/>
      <while cond="!GpsFixValid()"/>
    </block>
    <block name="Geo init">
      <while cond="LessThan(NavBlockTime(), 10)"/>
      <call_once fun="NavSetGroundReferenceHere()"/>
    </block>
    <block name="Holding point">
      <call_once fun="NavKillThrottle()"/>
      <attitude pitch="0" roll="0" throttle="0" until="FALSE" vmode="throttle"/>
    </block>
    <block name="Start Engine">
      <call_once fun="NavResurrect()"/>
      <attitude pitch="0" roll="0" throttle="0" until="FALSE" vmode="throttle"/>
    </block>
    <block name="Takeoff" strip_button="Takeoff" strip_icon="takeoff.png">
      <exception cond="stateGetPositionEnu_f()->z > 2.0" deroute="Standby"/>
      <call_once fun="NavSetWaypointHere(WP_CLIMB)"/>
      <stay climb="2.0" vmode="climb" wp="CLIMB"/>
    </block>
    <block name="Standby" strip_button="Standby" strip_icon="home.png">
      <stay wp="STDBY"/>
    </block>
    <block name="stay_p1">
      <stay wp="p1"/>
    </block>
    <block name="go_p2">
      <go wp="p2"/>
      <deroute block="stay_p1"/>
    </block>
    <block name="line_p1_p2">
      <go from="p1" hmode="route" wp="p2"/>
      <stay until="stage_time>10" wp="p2"/>
      <go from="p2" hmode="route" wp="p1"/>
      <deroute block="stay_p1"/>
    </block>
    <block name="route">
      <go from="p1" hmode="route" wp="p2"/>
      <go from="p2" hmode="route" wp="p3"/>
      <go from="p3" hmode="route" wp="p4"/>
      <go from="p4" hmode="route" wp="p1"/>
      <deroute block="stay_p1"/>
    </block>
    <block name="land here" strip_button="Land Here" strip_icon="land-right.png">
      <call_once fun="NavSetWaypointHere(WP_TD)"/>
    </block>
    <block name="land">
      <go wp="TD"/>
    </block>
    <block name="descend">
      <exception cond="!(stateGetPositionEnu_f()->z > 15.0)" deroute="flare"/>
      <stay climb="-1.5" vmode="climb" wp="TD"/>
    </block>
    <block name="flare">
      <stay climb="-0.4" vmode="climb" wp="TD"/>
      <exception cond="!(stateGetPositionEnu_f()->z > 2.0)" deroute="flare_low"/>
    </block>
    <block name="flare_low">
      <exception cond="NavDetectGround()" deroute="Holding point"/>
      <exception cond="!nav_is_in_flight()" deroute="landed"/>
      <call_once fun="NavStartDetectGround()"/>
      <stay climb="-0.4" vmode="climb" wp="TD"/>
    </block>
    <block name="landed">
      <attitude pitch="0" roll="0" throttle="0" until="FALSE" vmode="throttle"/>
    </block>
  </blocks>
</flight_plan>
